{
    "TargetNumberOfRootPeers": 100,
    "TargetNumberOfKnownPeers": 100,
    "TargetNumberOfEstablishedPeers": 30,
    "TargetNumberOfActivePeers": 20,
    "TargetNumberOfKnownBigLedgerPeers": 15,
    "TargetNumberOfEstablishedBigLedgerPeers": 10,
    "TargetNumberOfActiveBigLedgerPeers": 5,
    "PeerSharing": false
}
