{
    "DiffusionMode": "InitiatorAndResponder",
    "MaxConcurrencyBulkSync": 1,
    "MaxConcurrencyDeadline": 1,
    "EgressPollInterval": 0,
    "ChainSyncIdleTimeout": 3373,
    "AcceptedConnectionsLimit": {
        "hardLimit": 512,
        "softLimit": 384,
        "delay": 5
    },
    "SyncTargetNumberOfRootPeers": 0,
    "SyncTargetNumberOfKnownPeers": 150,
    "SyncTargetNumberOfEstablishedPeers": 10,
    "SyncTargetNumberOfActivePeers": 5,
    "SyncTargetNumberOfKnownBigLedgerPeers": 100,
    "SyncTargetNumberOfEstablishedBigLedgerPeers": 40,
    "SyncTargetNumberOfActiveBigLedgerPeers": 30,
    "ExperimentalProtocolsEnabled": false,
    "ProtocolIdleTimeout": 5,
    "TimeWaitTimeout": 60,
    "TxSubmissionInitDelay": 0,
    "MinBigLedgerPeersForTrustedState": 5,
    "TxSubmissionLogicVersion": "V1",
    "ResponderCoreAffinityPolicy": "Disabled"
}
